{
  "modelVersion": "v1",
  "sessions": [
    {
      "sessionType": "FullBody",
      "name": "Session 1",
      "slots": [
        {
          "slotId": "s0_HorizontalPress|Chest|Anchor|false|Any",
          "role": "Anchor",
          "pattern": "HorizontalPress",
          "primaryMuscle": "Chest",
          "repProfile": "LowerMachineOrUpperPress",
          "lengthBiasPreference": null,
          "siblingVariant": null,
          "isCrossDomainTouch": false,
          "allowedFatigueProfiles": null
        },
        {
          "slotId": "s0_ElbowExtension|Tricep|Accessory|false|Any",
          "role": "Accessory",
          "pattern": "ElbowExtension",
          "primaryMuscle": "Tricep",
          "repProfile": "Isolation",
          "lengthBiasPreference": null,
          "siblingVariant": null,
          "isCrossDomainTouch": false,
          "allowedFatigueProfiles": null
        },
        {
          "slotId": "s0_HipHinge|Hamstring|Anchor|false|Any",
          "role": "Anchor",
          "pattern": "HipHinge",
          "primaryMuscle": "Hamstring",
          "repProfile": "LowerFreeWeightCompound",
          "lengthBiasPreference": null,
          "siblingVariant": null,
          "isCrossDomainTouch": false,
          "allowedFatigueProfiles": null
        },
        {
          "slotId": "s0_KneeExtension|Quad|Accessory|false|Any",
          "role": "Accessory",
          "pattern": "KneeExtension",
          "primaryMuscle": "Quad",
          "repProfile": "Isolation",
          "lengthBiasPreference": null,
          "siblingVariant": null,
          "isCrossDomainTouch": false,
          "allowedFatigueProfiles": [
            "Low",
            "Medium"
          ]
        },
        {
          "slotId": "s0_HorizontalPull|Back|SecondaryCompound|false|Any",
          "role": "SecondaryCompound",
          "pattern": "HorizontalPull",
          "primaryMuscle": "Back",
          "repProfile": "UpperMachineOrPull",
          "lengthBiasPreference": null,
          "siblingVariant": null,
          "isCrossDomainTouch": false,
          "allowedFatigueProfiles": null
        },
        {
          "slotId": "s0_VerticalPull|Back|Anchor|false|Any",
          "role": "Anchor",
          "pattern": "VerticalPull",
          "primaryMuscle": "Back",
          "repProfile": "UpperMachineOrPull",
          "lengthBiasPreference": null,
          "siblingVariant": null,
          "isCrossDomainTouch": false,
          "allowedFatigueProfiles": null
        }
      ],
      "siblingIndex": 0,
      "position": 0,
      "composition": null
    },
    {
      "sessionType": "FullBody",
      "name": "Session 2",
      "slots": [
        {
          "slotId": "s1_HorizontalPress|Chest|Anchor|false|Any",
          "role": "Anchor",
          "pattern": "HorizontalPress",
          "primaryMuscle": "Chest",
          "repProfile": "LowerMachineOrUpperPress",
          "lengthBiasPreference": null,
          "siblingVariant": null,
          "isCrossDomainTouch": false,
          "allowedFatigueProfiles": null
        },
        {
          "slotId": "s1_ShoulderAbduction|LateralDeltoid|Accessory|false|Any",
          "role": "Accessory",
          "pattern": "ShoulderAbduction",
          "primaryMuscle": "LateralDeltoid",
          "repProfile": "Isolation",
          "lengthBiasPreference": null,
          "siblingVariant": null,
          "isCrossDomainTouch": false,
          "allowedFatigueProfiles": null
        },
        {
          "slotId": "s1_SquatPattern|Quad|Anchor|false|Any",
          "role": "Anchor",
          "pattern": "SquatPattern",
          "primaryMuscle": "Quad",
          "repProfile": "LowerFreeWeightCompound",
          "lengthBiasPreference": null,
          "siblingVariant": null,
          "isCrossDomainTouch": false,
          "allowedFatigueProfiles": null
        },
        {
          "slotId": "s1_HipHinge|Hamstring|Anchor|false|Any",
          "role": "Anchor",
          "pattern": "HipHinge",
          "primaryMuscle": "Hamstring",
          "repProfile": "LowerFreeWeightCompound",
          "lengthBiasPreference": null,
          "siblingVariant": null,
          "isCrossDomainTouch": false,
          "allowedFatigueProfiles": null
        },
        {
          "slotId": "s1_KneeExtension|Quad|Accessory|false|Any",
          "role": "Accessory",
          "pattern": "KneeExtension",
          "primaryMuscle": "Quad",
          "repProfile": "Isolation",
          "lengthBiasPreference": null,
          "siblingVariant": null,
          "isCrossDomainTouch": false,
          "allowedFatigueProfiles": [
            "Low",
            "Medium"
          ]
        }
      ],
      "siblingIndex": 0,
      "position": 1,
      "composition": null
    },
    {
      "sessionType": "FullBody",
      "name": "Session 3",
      "slots": [
        {
          "slotId": "s2_HorizontalPress|Chest|Anchor|false|Any",
          "role": "Anchor",
          "pattern": "HorizontalPress",
          "primaryMuscle": "Chest",
          "repProfile": "LowerMachineOrUpperPress",
          "lengthBiasPreference": null,
          "siblingVariant": null,
          "isCrossDomainTouch": false,
          "allowedFatigueProfiles": null
        },
        {
          "slotId": "s2_VerticalPull|Back|SecondaryCompound|false|A",
          "role": "SecondaryCompound",
          "pattern": "VerticalPull",
          "primaryMuscle": "Back",
          "repProfile": "UpperMachineOrPull",
          "lengthBiasPreference": null,
          "siblingVariant": "A",
          "isCrossDomainTouch": false,
          "allowedFatigueProfiles": null
        },
        {
          "slotId": "s2_ShoulderAbduction|LateralDeltoid|Accessory|false|Any",
          "role": "Accessory",
          "pattern": "ShoulderAbduction",
          "primaryMuscle": "LateralDeltoid",
          "repProfile": "Isolation",
          "lengthBiasPreference": null,
          "siblingVariant": null,
          "isCrossDomainTouch": false,
          "allowedFatigueProfiles": null
        },
        {
          "slotId": "s2_HipHinge|Hamstring|Anchor|false|Any",
          "role": "Anchor",
          "pattern": "HipHinge",
          "primaryMuscle": "Hamstring",
          "repProfile": "LowerFreeWeightCompound",
          "lengthBiasPreference": null,
          "siblingVariant": null,
          "isCrossDomainTouch": false,
          "allowedFatigueProfiles": null
        },
        {
          "slotId": "s2_KneeFlexion|Hamstring|Accessory|false|Any",
          "role": "Accessory",
          "pattern": "KneeFlexion",
          "primaryMuscle": "Hamstring",
          "repProfile": "Isolation",
          "lengthBiasPreference": null,
          "siblingVariant": null,
          "isCrossDomainTouch": false,
          "allowedFatigueProfiles": [
            "Low",
            "Medium"
          ]
        }
      ],
      "siblingIndex": 0,
      "position": 2,
      "composition": null
    }
  ],
  "plans": [
    {
      "sessionType": "FullBody",
      "name": "Session 1",
      "slots": [
        {
          "slotId": "s0_HorizontalPress|Chest|Anchor|false|Any",
          "role": "Anchor",
          "pattern": "HorizontalPress",
          "primaryMuscle": "Chest",
          "repProfile": "LowerMachineOrUpperPress",
          "lengthBiasPreference": null,
          "siblingVariant": null,
          "isCrossDomainTouch": false,
          "allowedFatigueProfiles": null
        },
        {
          "slotId": "s0_ElbowExtension|Tricep|Accessory|false|Any",
          "role": "Accessory",
          "pattern": "ElbowExtension",
          "primaryMuscle": "Tricep",
          "repProfile": "Isolation",
          "lengthBiasPreference": null,
          "siblingVariant": null,
          "isCrossDomainTouch": false,
          "allowedFatigueProfiles": null
        },
        {
          "slotId": "s0_HipHinge|Hamstring|Anchor|false|Any",
          "role": "Anchor",
          "pattern": "HipHinge",
          "primaryMuscle": "Hamstring",
          "repProfile": "LowerFreeWeightCompound",
          "lengthBiasPreference": null,
          "siblingVariant": null,
          "isCrossDomainTouch": false,
          "allowedFatigueProfiles": null
        },
        {
          "slotId": "s0_KneeExtension|Quad|Accessory|false|Any",
          "role": "Accessory",
          "pattern": "KneeExtension",
          "primaryMuscle": "Quad",
          "repProfile": "Isolation",
          "lengthBiasPreference": null,
          "siblingVariant": null,
          "isCrossDomainTouch": false,
          "allowedFatigueProfiles": [
            "Low",
            "Medium"
          ]
        },
        {
          "slotId": "s0_HorizontalPull|Back|SecondaryCompound|false|Any",
          "role": "SecondaryCompound",
          "pattern": "HorizontalPull",
          "primaryMuscle": "Back",
          "repProfile": "UpperMachineOrPull",
          "lengthBiasPreference": null,
          "siblingVariant": null,
          "isCrossDomainTouch": false,
          "allowedFatigueProfiles": null
        },
        {
          "slotId": "s0_VerticalPull|Back|Anchor|false|Any",
          "role": "Anchor",
          "pattern": "VerticalPull",
          "primaryMuscle": "Back",
          "repProfile": "UpperMachineOrPull",
          "lengthBiasPreference": null,
          "siblingVariant": null,
          "isCrossDomainTouch": false,
          "allowedFatigueProfiles": null
        }
      ],
      "siblingIndex": 0,
      "position": 0,
      "filledSlots": [
        {
          "slotId": "s0_HorizontalPress|Chest|Anchor|false|Any",
          "role": "Anchor",
          "pattern": "HorizontalPress",
          "primaryMuscle": "Chest",
          "repProfile": "LowerMachineOrUpperPress",
          "lengthBiasPreference": null,
          "siblingVariant": null,
          "isCrossDomainTouch": false,
          "allowedFatigueProfiles": null,
          "setCount": 3
        },
        {